<?xml version="1.0" encoding="UTF-8" ?>
<!DOCTYPE playList  SYSTEM "playList.dtd">
<?xml-stylesheet type="text/css" href="playList.css"?>
<!-- This XML document describes a playlist of movies -->
<playList>
    
    <movie movieID="m1">
        <director>
            <name>Chris Columbus</name>
        </director>
        <title>Harry Potter and the Chamber of Secrets</title>
        <runTime>161</runTime>
        <productionCompany>Warner Bros.</productionCompany>
        <imdbRef>tt0295297</imdbRef>
        <year>2002</year>
        <metascore>63</metascore>
        <rottenTomatoes>82</rottenTomatoes>
    </movie>
</playList>